{"schema_version":"symbol_index.v1","name":"redact","kind":"function","language":"typescript","signature":"(value: unknown) => unknown","location":{"repo":"aws-builder-agent","path":"src/telemetry/redact.ts","line":12,"sha":"ef96160"},"purpose":"Strip secrets from values before they reach logs or span attributes.","visibility":"shared","boundary":"agent-core","body_hash":"ts-norm-v1:9f2c4be1","tags":["security","telemetry"],"callers":7,"callees":1,"cognitive_complexity":4}
